{
  "$schema": "http://json-schema.org/draft-07/schema#",
  "$id": "https://github.com/numan-cli/numan-registry/schemas/index-v1.json",
  "title": "Numan Registry Index v1",
  "description": "Schema for the signed Numan registry index.",
  "type": "object",
  "required": ["schema_version", "updated_at", "packages"],
  "additionalProperties": false,
  "properties": {
    "schema_version": {
      "type": "integer",
      "minimum": 1,
      "maximum": 1,
      "description": "Registry index schema version. Must be 1."
    },
    "updated_at": {
      "type": "string",
      "format": "date-time",
      "description": "ISO 8601 timestamp of the last index update."
    },
    "registry_revision": {
      "type": "string",
      "description": "Opaque registry revision identifier."
    },
    "trust": {
      "type": "object",
      "description": "Successor key declarations introduced by a signed index.",
      "additionalProperties": false,
      "properties": {
        "keys": {
          "type": "array",
          "items": {
            "type": "object",
            "required": ["key_id", "public_key_b64"],
            "additionalProperties": false,
            "properties": {
              "key_id": {
                "type": "string",
                "minLength": 1
              },
              "public_key_b64": {
                "type": "string",
                "contentEncoding": "base64"
              }
            }
          }
        }
      }
    },
    "packages": {
      "type": "array",
      "items": {
        "type": "object",
        "required": ["id", "description", "repo", "type", "tags", "versions"],
        "additionalProperties": false,
        "properties": {
          "id": {
            "type": "object",
            "required": ["owner", "name"],
            "additionalProperties": false,
            "properties": {
              "owner": { "type": "string", "minLength": 1 },
              "name": { "type": "string", "minLength": 1 }
            }
          },
          "description": { "type": "string" },
          "repo": { "type": "string", "format": "uri" },
          "type": {
            "type": "string",
            "enum": ["plugin", "module", "script", "completion"]
          },
          "tags": {
            "type": "array",
            "items": { "type": "string" }
          },
          "versions": {
            "type": "array",
            "items": {
              "type": "object",
              "required": ["version", "nu_version", "artifact"],
              "additionalProperties": false,
              "properties": {
                "version": { "type": "string" },
                "nu_version": { "type": "string" },
                "evidence_tier": {
                  "type": "string",
                  "enum": ["proven", "provisional"],
                  "description": "Absence means 'proven' (full lifecycle evidence). 'provisional' means the version passed structural validation only; deferral_reason should explain why lifecycle-prove was skipped."
                },
                "deferral_reason": {
                  "type": "string",
                  "pattern": ".*\\S.*",
                  "description": "Required alongside evidence_tier: 'provisional' — explains why lifecycle-prove was deferred."
                },
                "provenance": {
                  "type": "string",
                  "enum": ["commit-snapshot"],
                  "description": "Optional provenance marker. 'commit-snapshot' indicates the version was built from a pinned commit with no upstream tag; requires source.rev to be present."
                },
                "verified_with": {
                  "type": "array",
                  "minItems": 1,
                  "items": {
                    "type": "string",
                    "pattern": "^(0|[1-9][0-9]*)\\.(0|[1-9][0-9]*)\\.(0|[1-9][0-9]*)$"
                  }
                },
                "artifact": {
                  "type": "object",
                  "required": ["kind"],
                  "additionalProperties": false,
                  "properties": {
                    "kind": {
                      "type": "string",
                      "enum": ["binary", "archive", "source"]
                    },
                    "url": { "type": "string", "format": "uri" },
                    "sha256": { "type": "string", "pattern": "^[a-fA-F0-9]{64}$" },
                    "targets": {
                      "type": "object",
                      "additionalProperties": {
                        "type": "object",
                        "required": ["url", "sha256", "executable_path"],
                        "additionalProperties": false,
                        "properties": {
                          "url": { "type": "string", "format": "uri" },
                          "sha256": { "type": "string", "pattern": "^[a-fA-F0-9]{64}$" },
                          "executable_path": { "type": "string" }
                        }
                      }
                    },
                    "archive_root": { "type": "string" },
                    "include": {
                      "type": "array",
                      "items": { "type": "string" }
                    },
                    "entry": { "type": "string" }
                  }
                },
                "source": {
                  "type": "object",
                  "required": ["git", "rev"],
                  "additionalProperties": false,
                  "properties": {
                    "git": { "type": "string" },
                    "rev": { "type": "string" },
                    "cargo_name": { "type": "string" },
                    "cargo_lock_sha256": { "type": "string" },
                    "upstream": {
                      "type": "string",
                      "description": "Original upstream repo URL, set only when this version is a numan-maintained fork (owner: \"numan-maintained\"). `git`/`rev` above point at the fork; `upstream` preserves the original author's identity so installing the original owner/name is never silently substituted."
                    }
                  }
                },
                "dependencies": {
                  "type": "object",
                  "additionalProperties": { "type": "string" }
                },
                "activation": {
                  "type": "object",
                  "required": ["kind"],
                  "additionalProperties": false,
                  "properties": {
                    "kind": { "type": "string" },
                    "import": { "type": "string", "enum": ["module", "all"] },
                    "bindings": {
                      "type": "array",
                      "minItems": 1,
                      "items": {
                        "type": "object",
                        "required": ["id", "event", "handler"],
                        "additionalProperties": false,
                        "properties": {
                          "id": { "type": "string", "minLength": 1 },
                          "event": { "type": "string", "enum": ["pre_prompt", "pre_execution", "env_change", "display_output"] },
                          "handler": { "type": "string", "minLength": 1 },
                          "filter": { "type": "string", "minLength": 1 }
                        }
                      }
                    },
                    "targets": {
                      "type": "array",
                      "minItems": 1,
                      "items": {
                        "type": "object",
                        "required": ["command", "path", "kind"],
                        "additionalProperties": false,
                        "properties": {
                          "command": { "type": "string", "minLength": 1 },
                          "path": { "type": "string", "minLength": 1 },
                          "kind": { "type": "string", "enum": ["static", "command-backed"] }
                        }
                      }
                    },
                    "entry_points": {
                      "type": "array",
                      "minItems": 1,
                      "items": {
                        "type": "object",
                        "required": ["name", "path"],
                        "additionalProperties": false,
                        "properties": {
                          "name": { "type": "string", "minLength": 1 },
                          "path": { "type": "string", "minLength": 1 }
                        }
                      }
                    }
                  },
                  "allOf": [
                    {
                      "if": { "required": ["bindings"] },
                      "then": { "properties": { "kind": { "const": "nu-hook" } } }
                    },
                    {
                      "if": { "required": ["targets"] },
                      "then": { "properties": { "kind": { "const": "nu-completion" } } }
                    },
                    {
                      "if": { "required": ["entry_points"] },
                      "then": { "properties": { "kind": { "const": "nu-script" } } }
                    },
                    {
                      "if": { "properties": { "kind": { "const": "nu-completion" } } },
                      "then": { "required": ["targets"] }
                    },
                    {
                      "if": { "properties": { "kind": { "const": "nu-script" } } },
                      "then": { "required": ["entry_points"] }
                    }
                  ]
                }
              },
              "allOf": [
                {
                  "if": {
                    "properties": { "evidence_tier": { "const": "provisional" } },
                    "required": ["evidence_tier"]
                  },
                  "then": {
                    "required": ["deferral_reason"]
                  }
                },
                {
                  "if": {
                    "properties": { "provenance": { "const": "commit-snapshot" } },
                    "required": ["provenance"]
                  },
                  "then": {
                    "required": ["source"],
                    "properties": {
                      "source": {
                        "properties": {
                          "rev": {
                            "pattern": "^[a-f0-9]{40}$"
                          }
                        }
                      }
                    }
                  }
                }
              ]
            }
          }
        },
        "allOf": [
          {
            "if": {
              "properties": {
                "type": { "const": "plugin" }
              },
              "required": ["type"]
            },
            "then": {
              "properties": {
                "versions": {
                  "items": {
                    "properties": {
                      "source": {
                        "type": "object",
                        "required": ["git", "rev", "cargo_name"]
                      }
                    }
                  }
                }
              }
            }
          }
        ]
      }
    }
  }
}
